language	iso_code	gloss	global_id	local_id	transcription	cognate_class	tokens	notes
Shenyang		to play	1413	1413	uanr³⁵	1229	u a n r ³⁵	
Changsha		to play	1413	1413	uan¹³	1229	u a n ¹³	
Beijing		to smell (perceive odor) [transitive]	1586	1586	uən³⁵	1039	u ə n ³⁵	
Jinan		to smell (perceive odor) [transitive]	1586	1586	uẽ⁴²	1039	u ẽ ∼ ⁴²	
Shenyang		to smell (perceive odor) [transitive]	1586	1586	uən³⁵	1039	u ə n ³⁵	
Xian		to smell (perceive odor) [transitive]	1586	1586	vẽ²⁴	1039	v ẽ ∼ ²⁴	
Chengdu		to smell (perceive odor) [transitive]	1586	1586	uən³¹	1039	u ə n ³¹	
Kunming		to smell (perceive odor) [transitive]	1586	1586	uə̃³¹	1039	u ə̃ ∼ ³¹	
Hefei		to smell (perceive odor) [transitive]	1586	1586	un⁵⁵	1039	u n ⁵⁵	
Yangzhou		to smell (perceive odor) [transitive]	1586	1586	uəŋ³⁴	1039	u ə ŋ ³⁴	
Suzhou		to smell (perceive odor) [transitive]	1586	1586	mən²⁴	1039	m ə n ²⁴	
Wenzhou		to smell (perceive odor) [transitive]	1586	1586	hoŋ⁴²	1040	h o ŋ ⁴²	
Changsha		to smell (perceive odor) [transitive]	1586	1586	uən¹³	1039	u ə n ¹³	
Changsha		to smell (perceive odor) [transitive]	1586	1586	tʰin⁵⁵	1041	tʰ i n ⁵⁵	
Nanchang		to smell (perceive odor) [transitive]	1586	1586	ɕiuŋ⁵⁵	1040	ɕ i u ŋ ⁵⁵	
Nanchang		to smell (perceive odor) [transitive]	1586	1586	un⁵⁵	1039	u n ⁵⁵	
Meixian		to smell (perceive odor) [transitive]	1586	1586	pʰi⁴²	1042	pʰ i ⁴²	
Guangzhou		to smell (perceive odor) [transitive]	1586	1586	nɐn²¹	1039	n ɐ n ²¹	
Yangjiang		to smell (perceive odor) [transitive]	1586	1586	mɐn⁴⁴³	1039	m ɐ n ⁴⁴³	
Xiamen		to smell (perceive odor) [transitive]	1586	1586	pʰĩ³³	1042	pʰ ĩ ∼ ³³	
Chaozhou		to smell (perceive odor) [transitive]	1586	1586	pʰĩ¹¹	1042	pʰ ĩ ∼ ¹¹	
Fuzhou		to smell (perceive odor) [transitive]	1586	1586	pei²⁴²	1042	p e i ²⁴²	
Beijing		to throw	1456	1456	ʐəŋ⁵⁵	1099	ʐ ə ŋ ⁵⁵	
Jinan		to throw	1456	1456	ʐəŋ²¹³.	1099	ʐ ə ŋ ²¹³	
Shenyang		to throw	1456	1456	ləŋ³³	1099	l ə ŋ ³³	
Xian		to throw	1456	1456	ʐəŋ²¹	1099	ʐ ə ŋ ²¹	
Chengdu		to throw	1456	1456	suai⁵³	1100	s u a i ⁵³	
Kunming		to throw	1456	1456	tio⁴⁴	1101	t i o ⁴⁴	
Hefei		to throw	1456	1456	niɔ⁵³	1102	n i ɔ ⁵³	
Yangzhou		to throw	1456	1456	liɔ⁵⁵	1100	l i ɔ ⁵⁵	
Yangzhou		to throw	1456	1456	suɛ³¹	1103	s u ɛ ³¹	
Yangzhou		to throw	1456	1456	tsʰuɛ⁵⁵	1104	tsʰ u ɛ ⁵⁵	
Suzhou		to throw	1456	1456	guɛ³¹	1105	g u ɛ ³¹	
Suzhou		to throw	1456	1456	toʔ⁴	1106	t o ʔ ⁴	
Wenzhou		to throw	1456	1456	ga¹¹	1105	g a ¹¹	
Changsha		to throw	1456	1456	tiəu³³	1101	t i ə u ³³	
Nanchang		to throw	1456	1456	tiu⁴²	1101	t i u ⁴²	
Meixian		to throw	1456	1456	tiu⁴⁴	1101	t i u ⁴⁴	
Guangzhou		to throw	1456	1456	pʰɛk³³	1107	pʰ ɛ k ³³	
Guangzhou		to throw	1456	1456	wɪŋ³³	1108	w ɪ ŋ ³³	
Guangzhou		to throw	1456	1456	tɛŋ³³	1109	t ɛ ŋ ³³	
Yangjiang		to throw	1456	1456	pʰɪk²⁴	1107	pʰ ɪ k ²⁴	
Xiamen		to throw	1456	1456	hĩ¹¹	1110	h ĩ ∼ ¹¹	
Chaozhou		to throw	1456	1456	kak⁴	1111	k a k ⁴	
Fuzhou		to throw	1456	1456	liu⁴⁴	1100	l i u ⁴⁴	
Fuzhou		to throw	1456	1456	kʰœʔ⁴₃₁œʔ⁴	1112	kʰ œ ʔ ⁴ œ ʔ ⁴	
Beijing		tomorrow	1329	1329	miŋ³⁵tʰian⁰	552	m i ŋ ³⁵ tʰ i a n ⁰	
Beijing		tomorrow	1329	1329	miŋr³⁵	551	m i ŋ r ³⁵	
Jinan		tomorrow	1329	1329	miŋ⁴²tʰiæ̃⁰	552	m i ŋ ⁴² tʰ i æ̃ ∼ ⁰	
Jinan		tomorrow	1329	1329	miŋr⁴²	551	m i ŋ r ⁴²	
Shenyang		tomorrow	1329	1329	miŋr³⁵kə⁰	553	m i ŋ r ³⁵ k ə ⁰	
Xian		tomorrow	1329	1329	miŋr²⁴kə⁰	553	m i ŋ r ²⁴ k ə ⁰	
Chengdu		tomorrow	1329	1329	min³¹tʰian⁴⁴	552	m i n ³¹ tʰ i a n ⁴⁴	
Kunming		tomorrow	1329	1329	mĩr³¹ʐʅ³¹₄₄	554	m ĩ ∼ r ³¹ ʐ ʅ ³¹	
Hefei		tomorrow	1329	1329	min⁵⁵kə⁰	553	m i n ⁵⁵ k ə ⁰	
Hefei		tomorrow	1329	1329	ma⁵⁵tʰiĩ²¹²	560	m a ⁵⁵ tʰ i ĩ ∼ ²¹²	
Yangzhou		tomorrow	1329	1329	miŋ³⁴kɤɯ⁰	553	m i ŋ ³⁴ k ɤ ɯ ⁰	
Suzhou		tomorrow	1329	1329	mən²⁴₂₂tsæ⁴⁴	555	m ə n ²⁴ ts æ ⁴⁴	
Wenzhou		tomorrow	1329	1329	maŋ³¹tɕiɛ⁴⁴	555	m a ŋ ³¹ tɕ i ɛ ⁴⁴	
Changsha		tomorrow	1329	1329	min¹³zɿ²⁴	554	m i n ¹³ z ɿ ²⁴	
Nanchang		tomorrow	1329	1329	miaŋ⁵⁵ȵit⁵	554	m i a ŋ ⁵⁵ nʲ i t ⁵	
Meixian		tomorrow	1329	1329	tʰiɛn⁴⁴kuɔŋ⁴⁴ȵit²¹	559	tʰ i ɛ n ⁴⁴ k u ɔ ŋ ⁴⁴ nʲ i t ²¹	
Meixian		tomorrow	1329	1329	tʰin⁴⁴pu⁴⁴ȵit²¹	562	tʰ i n ⁴⁴ p u ⁴⁴ nʲ i t ²¹	
Guangzhou		tomorrow	1329	1329	tʰɪŋ⁵³jɐt²	561	tʰ ɪ ŋ ⁵³ j ɐ t ²	
Yangjiang		tomorrow	1329	1329	lɔi⁴⁴³jɐt⁴⁵⁴	563	l ɔ i ⁴⁴³ j ɐ t ⁴⁵⁴	
Xiamen		tomorrow	1329	1329	bin²⁴₃₃nã⁵¹₅₅lit⁵	556	b i n ²⁴ n ã ∼ ⁵¹ l i t ⁵	
Xiamen		tomorrow	1329	1329	bin²⁴₃₃nã⁵¹₅₅tsai¹¹	557	b i n ²⁴ n ã ∼ ⁵¹ ts a i ¹¹	
Chaozhou		tomorrow	1329	1329	mua²¹³₅₃kʰi⁵³₂₁	565	m u a ²¹³ kʰ i ⁵³	
Chaozhou		tomorrow	1329	1329	mua²¹³₅₃zik⁴	564	m u a ²¹³ z i k ⁴	
Fuzhou		tomorrow	1329	1329	miŋ⁵²₃₁naŋ²¹³	558	m i ŋ ⁵² n a ŋ ²¹³	
Beijing		wet	1726	1726	ʂʅ⁵⁵	99	ʂ ʅ ⁵⁵	
Jinan		wet	1726	1726	ʂʅ²¹³	99	ʂ ʅ ²¹³	
Shenyang		wet	1726	1726	sๅ³³	99	s ɿ ³³	
Xian		wet	1726	1726	ʂʅ²¹	99	ʂ ʅ ²¹	
Chengdu		wet	1726	1726	sๅ³¹	99	s ɿ ³¹	
Kunming		wet	1726	1726	ʂʅ³¹	99	ʂ ʅ ³¹	
Hefei		wet	1726	1726	tʂʰɔ⁵⁵	101	ʈʂʰ ɔ ⁵⁵	
Yangzhou		wet	1726	1726	səʔ⁴	99	s ə ʔ ⁴	
Suzhou		wet	1726	1726	sɤʔ⁴	99	s ɤ ʔ ⁴	
Suzhou		wet	1726	1726	zæ²⁴	101	z æ ²⁴	
Wenzhou		wet	1726	1726	sai²³	99	s a i ²³	
Wenzhou		wet	1726	1726	la¹¹	102	l a ¹¹	
Changsha		wet	1726	1726	sๅ²⁴	99	s ɿ ²⁴	
Nanchang		wet	1726	1726	sət⁵	99	s ə t ⁵	
Meixian		wet	1726	1726	səp²¹	99	s ə p ²¹	
Guangzhou		wet	1726	1726	ʃɐp⁵	99	ʃ ɐ p ⁵	
Yangjiang		wet	1726	1726	ʃɐp²⁴	99	ʃ ɐ p ²⁴	
Xiamen		wet	1726	1726	tam²⁴	103	t a m ²⁴	
Xiamen		wet	1726	1726	sip³²	99	s i p ³²	
Chaozhou		wet	1726	1726	tan⁵⁵	104	t a n ⁵⁵	
Fuzhou		wet	1726	1726	laŋ²⁴²	102	l a ŋ ²⁴²	
Fuzhou		wet	1726	1726	seiʔ²³	99	s e i ʔ ²³	
