language	iso_code	gloss	global_id	local_id	transcription	cognate_class	tokens	notes
Beijing		horizontal	2376	2376	xəŋ³⁵	83	x ə ŋ ³⁵	
Jinan		horizontal	2376	2376	xəŋ⁴²	83	x ə ŋ ⁴²	
Shenyang		horizontal	2376	2376	xəŋ³⁵	83	x ə ŋ ³⁵	
Xian		horizontal	2376	2376	ɕye²⁴	84	ɕ y e ²⁴	
Chengdu		horizontal	2376	2376	xuən³¹	83	x u ə n ³¹	
Kunming		horizontal	2376	2376	xuə̃³¹	83	x u ə̃ ∼ ³¹	
Hefei		horizontal	2376	2376	xʊ̃⁵⁵	83	x ʊ̃ ∼ ⁵⁵	
Yangzhou		horizontal	2376	2376	xoŋ³⁴	83	x o ŋ ³⁴	
Suzhou		horizontal	2376	2376	ɦuaŋ²⁴	83	ɦ u a ŋ ²⁴	
Wenzhou		horizontal	2376	2376	viɛ³¹	83	v i ɛ ³¹	
Changsha		horizontal	2376	2376	fən¹³	83	f ə n ¹³	
Nanchang		horizontal	2376	2376	uaŋ⁵⁵	83	u a ŋ ⁵⁵	
Meixian		horizontal	2376	2376	vaŋ¹²	83	v a ŋ ¹²	
Guangzhou		horizontal	2376	2376	waŋ²¹	83	w a ŋ ²¹	
Yangjiang		horizontal	2376	2376	waŋ⁴⁴³	83	w a ŋ ⁴⁴³	
Xiamen		horizontal	2376	2376	hũãĩ²⁴	83	h ũ ã ĩ ∼ ²⁴	
Chaozhou		horizontal	2376	2376	hũẽ⁵⁵	83	h ũ ẽ ∼ ⁵⁵	
Fuzhou		horizontal	2376	2376	xuaŋ⁵²	83	x u a ŋ ⁵²	
Beijing		hot	1286	1286	ʐə⁵¹	168	ʐ ə ⁵¹	
Jinan		hot	1286	1286	ʐə²¹	168	ʐ ə ²¹	
Shenyang		hot	1286	1286	ie⁴¹	168	i e ⁴¹	
Xian		hot	1286	1286	ʐə²¹	168	ʐ ə ²¹	
Chengdu		hot	1286	1286	ze³¹	168	z e ³¹	
Kunming		hot	1286	1286	ʐə³¹	168	ʐ ə ³¹	
Hefei		hot	1286	1286	ʐɐʔ⁴	168	ʐ ɐ ʔ ⁴	
Yangzhou		hot	1286	1286	iəʔ⁴	168	i ə ʔ ⁴	
Suzhou		hot	1286	1286	ȵiɪʔ²³	168	nʲ i ɪ ʔ ²³	
Wenzhou		hot	1286	1286	ȵi¹²	168	nʲ i ¹²	
Changsha		hot	1286	1286	ye²⁴	168	y e ²⁴	
Nanchang		hot	1286	1286	lɛt⁵	168	l ɛ t ⁵	
Meixian		hot	1286	1286	ȵiayt⁴	168	nʲ i a y t ⁴	
Meixian		hot	1286	1286	sau⁴⁴	169	s a u ⁴⁴	
Guangzhou		hot	1286	1286	jit²²	168	j i t ²²	
Yangjiang		hot	1286	1286	jit⁴⁵⁴	168	j i t ⁴⁵⁴	
Xiamen		hot	1286	1286	liat⁵	168	l i a t ⁵	
Xiamen		hot	1286	1286	sio⁵⁵	169	s i o ⁵⁵	
Chaozhou		hot	1286	1286	sie³³	169	s i e ³³	
Fuzhou		hot	1286	1286	ieʔ⁴	168	i e ʔ ⁴	
Beijing		left	244	244	tsuo²¹⁴₃₅ʂou²¹⁴	714	ts u o ²¹⁴ ʂ o u ²¹⁴	
Jinan		left	244	244	tsuə²¹ʂou⁵⁵	714	ts u ə ²¹ ʂ o u ⁵⁵	
Shenyang		left	244	244	tsuə²¹³₃₅sou²¹³	714	ts u ə ²¹³ s o u ²¹³	
Xian		left	244	244	tsuo⁵³ʂou⁵³	714	ts u o ⁵³ ʂ o u ⁵³	
Chengdu		left	244	244	tso⁵³səu⁵³	714	ts o ⁵³ s ə u ⁵³	
Kunming		left	244	244	tsuo⁵³ʂəu⁵³	714	ts u o ⁵³ ʂ ə u ⁵³	
Hefei		left	244	244	tsʊ²⁴ʂɯ²⁴	714	ts ʊ ²⁴ ʂ ɯ ²⁴	
Yangzhou		left	244	244	tso⁴²sɤɯ⁴²	714	ts o ⁴² s ɤ ɯ ⁴²	
Yangzhou		left	244	244	tɕi⁵⁵sɤɯ⁴²	715	tɕ i ⁵⁵ s ɤ ɯ ⁴²	
Suzhou		left	244	244	tsi⁵¹³₄₄sʏ⁴¹₂₁	715	ts i ⁵¹³ s ʏ ⁴¹	
Suzhou		left	244	244	tsəu⁵¹³₄₄sʏ⁴¹₂₁	714	ts ə u ⁵¹³ s ʏ ⁴¹	
Wenzhou		left	244	244	tsei²³ɕiu⁴⁵	716	ts e i ²³ ɕ i u ⁴⁵	
Changsha		left	244	244	tso⁴¹səu⁴¹	714	ts o ⁴¹ s ə u ⁴¹	
Nanchang		left	244	244	tsɔ²¹³səu²¹³	714	ts ɔ ²¹³ s ə u ²¹³	
Meixian		left	244	244	tsɔ³¹su³¹	714	ts ɔ ³¹ s u ³¹	
Guangzhou		left	244	244	tʃɔ³⁵ʃɐu³⁵	714	tʃ ɔ ³⁵ ʃ ɐ u ³⁵	
Yangjiang		left	244	244	tʃɔ²¹ʃɐu²¹	714	tʃ ɔ ²¹ ʃ ɐ u ²¹	
Xiamen		left	244	244	to¹¹₅₁tsʰiu⁵¹	717	t o ¹¹ tsʰ i u ⁵¹	
Chaozhou		left	244	244	to²¹³₅₃tsʰiu⁵³₂₁	717	t o ²¹³ tsʰ i u ⁵³	
Fuzhou		left	244	244	siu³¹βeiŋ⁴⁴₅₂ȵiu⁵¹	722	s i u ³¹ β e i ŋ ⁴⁴ nʲ i u ⁵¹	
Beijing		that	78	78	na⁵¹kə⁰	262	n a ⁵¹ k ə ⁰	
Jinan		that	78	78	na²¹kə⁰	262	n a ²¹ k ə ⁰	
Shenyang		that	78	78	na⁴¹kə⁰	262	n a ⁴¹ k ə ⁰	
Xian		that	78	78	uo⁵³kə⁰	265	u o ⁵³ k ə ⁰	
Chengdu		that	78	78	na¹³ko¹³₄₄	262	n a ¹³ k o ¹³	
Kunming		that	78	78	nə¹³kə¹³	262	n ə ¹³ k ə ¹³	
Hefei		that	78	78	na⁵³kʊ⁵³	262	n a ⁵³ k ʊ ⁵³	
Yangzhou		that	78	78	ləʔ⁴kɤɯ⁰	266	l ə ʔ ⁴ k ɤ ɯ ⁰	
Suzhou		that	78	78	kuɛ⁴⁴kɤʔ⁴₂₁	267	k u ɛ ⁴⁴ k ɤ ʔ ⁴	
Suzhou		that	78	78	uɛ⁴⁴kɤʔ⁴₂₁	265	u ɛ ⁴⁴ k ɤ ʔ ⁴	
Wenzhou		that	78	78	hi⁴⁵kai⁴²	268	h i ⁴⁵ k a i ⁴²	
Changsha		that	78	78	lai⁵⁵ko⁵⁵	262	l a i ⁵⁵ k o ⁵⁵	
Nanchang		that	78	78	hɛ²⁴kɔ⁰	268	h ɛ ²⁴ k ɔ ⁰	
Meixian		that	78	78	kɛ⁴²kɛ⁴²	264	k ɛ ⁴² k ɛ ⁴²	
Guangzhou		that	78	78	kɔ³⁵kɔ³³	269	k ɔ ³⁵ k ɔ ³³	
Yangjiang		that	78	78	na²¹kɔ⁴⁵⁴	262	n a ²¹ k ɔ ⁴⁵⁴	
Xiamen		that	78	78	hit³²₅e²⁴	270	h i t ³² e ²⁴	
Chaozhou		that	78	78	hia⁵³kai⁵⁵₂₁	271	h i a ⁵³ k a i ⁵⁵	
Chaozhou		that	78	78	hia⁵³₂₄hia⁵³	272	h i a ⁵³ h i a ⁵³	
Fuzhou		that	78	78	xi³¹₄₄zieʔ²³	273	x i ³¹ z i e ʔ ²³	
Fuzhou		that	78	78	xy³¹βiʔ⁴	274	x y ³¹ β i ʔ ⁴	
Beijing		the father	1217	1217	pa⁵¹pa⁰	835	p a ⁵¹ p a ⁰	
Beijing		the father	1217	1217	tie⁵⁵	836	t i e ⁵⁵	
Jinan		the father	1217	1217	pa²¹pa⁰	835	p a ²¹ p a ⁰	
Shenyang		the father	1217	1217	pa⁴¹pa⁰	835	p a ⁴¹ p a ⁰	
Shenyang		the father	1217	1217	tie³³	836	t i e ³³	
Xian		the father	1217	1217	pɑ⁴⁵	834	p ɑ ⁴⁵	
Xian		the father	1217	1217	tɑ²⁴	838	t ɑ ²⁴	
Chengdu		the father	1217	1217	pa³¹pa³¹₄₄	835	p a ³¹ p a ³¹	
Kunming		the father	1217	1217	pa³¹pa³¹₄₄	835	p a ³¹ p a ³¹	
Hefei		the father	1217	1217	pɐʔ⁴pɐʔ⁴	839	p ɐ ʔ ⁴ p ɐ ʔ ⁴	
Yangzhou		the father	1217	1217	pɑ⁵⁵₃₄pɑ⁵⁵	835	p ɑ ⁵⁵ p ɑ ⁵⁵	
Yangzhou		the father	1217	1217	tiɑ³¹tiɑ³¹	837	t i ɑ ³¹ t i ɑ ³¹	
Suzhou		the father	1217	1217	tiɒ⁴⁴tiɒ⁴⁴₂₁	837	t i ɒ ⁴⁴ t i ɒ ⁴⁴	
Suzhou		the father	1217	1217	iɒ²⁴	840	i ɒ ²⁴	
Wenzhou		the father	1217	1217	a²³da¹¹	845	a ²³ d a ¹¹	
Wenzhou		the father	1217	1217	a²³pa²³	843	a ²³ p a ²³	
Changsha		the father	1217	1217	tie³³tie³³	837	t i e ³³ t i e ³³	
Changsha		the father	1217	1217	ie¹³	840	i e ¹³	
Nanchang		the father	1217	1217	tiɛ⁴²tiɛ⁰	837	t i ɛ ⁴² t i ɛ ⁰	
Nanchang		the father	1217	1217	pak⁵pak⁰	839	p a k ⁵ p a k ⁰	
Nanchang		the father	1217	1217	ia⁵⁵	840	i a ⁵⁵	
Meixian		the father	1217	1217	a⁴⁴pa⁴⁴	841	a ⁴⁴ p a ⁴⁴	
Meixian		the father	1217	1217	ja¹²	840	j a ¹²	
Guangzhou		the father	1217	1217	pa⁵⁵₂₁pa⁵⁵	835	p a ⁵⁵ p a ⁵⁵	
Guangzhou		the father	1217	1217	lou²³tɐu²²	847	l o u ²³ t ɐ u ²²	
Yangjiang		the father	1217	1217	a³³pa²⁴	841	a ³³ p a ²⁴	
Yangjiang		the father	1217	1217	a³³jɛ⁴⁴³	844	a ³³ j ɛ ⁴⁴³	
Yangjiang		the father	1217	1217	a³³tɛ³³	842	a ³³ t ɛ ³³	
Xiamen		the father	1217	1217	a³³pa⁵⁵	841	a ³³ p a ⁵⁵	
Xiamen		the father	1217	1217	lau³³₁₁pe³³	848	l a u ³³ p e ³³	
Chaozhou		the father	1217	1217	a³³₂₃pa³³	841	a ³³ p a ³³	
Chaozhou		the father	1217	1217	a³³₂₃tie³³	842	a ³³ t i e ³³	
Chaozhou		the father	1217	1217	a³³₂₃pe³⁵	846	a ³³ p e ³⁵	
Fuzhou		the father	1217	1217	i⁴⁴tie⁴⁴	849	i ⁴⁴ t i e ⁴⁴	
Fuzhou		the father	1217	1217	i⁴⁴ie⁵²	850	i ⁴⁴ i e ⁵²	
Fuzhou		the father	1217	1217	louŋ⁵²₃₁ma²⁴²	851	l o u ŋ ⁵² m a ²⁴²	
Beijing		the front (front side)	2194	2194	tɕʰian³⁵tʰou⁰	918	tɕʰ i a n ³⁵ tʰ o u ⁰	
Beijing		the front (front side)	2194	2194	tɕʰian³⁵pianr⁰	919	tɕʰ i a n ³⁵ p i a n r ⁰	
Jinan		the front (front side)	2194	2194	tɕʰiæ̃⁴²pɛr⁰	919	tɕʰ i æ̃ ∼ ⁴² p ɛ r ⁰	
Shenyang		the front (front side)	2194	2194	tɕʰian³⁵pianr⁰	919	tɕʰ i a n ³⁵ p i a n r ⁰	
Xian		the front (front side)	2194	2194	tɕʰiæ̃²⁴tʰou⁰	918	tɕʰ i æ̃ ∼ ²⁴ tʰ o u ⁰	
Chengdu		the front (front side)	2194	2194	tɕʰian³¹tʰəu³¹₄₄	918	tɕʰ i a n ³¹ tʰ ə u ³¹	
Kunming		the front (front side)	2194	2194	tɕʰiɛ³¹ʂəu⁵³	920	tɕʰ i ɛ ³¹ ʂ ə u ⁵³	
Hefei		the front (front side)	2194	2194	tɕʰiĩ⁵⁵tʰɯ⁰	918	tɕʰ i ĩ ∼ ⁵⁵ tʰ ɯ ⁰	
Yangzhou		the front (front side)	2194	2194	tɕʰiĩ³⁴tʰɤɯ⁰	918	tɕʰ i ĩ ∼ ³⁴ tʰ ɤ ɯ ⁰	
Suzhou		the front (front side)	2194	2194	ziɪ²⁴₂₂dʏ²⁴₃₃	918	z i ɪ ²⁴ d ʏ ²⁴	
Wenzhou		the front (front side)	2194	2194	maŋ³¹ɦi³¹	923	m a ŋ ³¹ ɦ i ³¹	
Changsha		the front (front side)	2194	2194	tɕiẽ¹³təu⁰	918	tɕ i ẽ ∼ ¹³ t ə u ⁰	
Nanchang		the front (front side)	2194	2194	tɕʰiɛn²⁴tʰɛu²⁴	918	tɕʰ i ɛ n ²⁴ tʰ ɛ u ²⁴	
Meixian		the front (front side)	2194	2194	miɛn⁴²tsʰiɛn¹²	924	m i ɛ n ⁴² tsʰ i ɛ n ¹²	
Guangzhou		the front (front side)	2194	2194	tʃʰin²¹pin²²	921	tʃʰ i n ²¹ p i n ²²	
Yangjiang		the front (front side)	2194	2194	min⁴⁵⁴tʃʰin⁴⁴³	924	m i n ⁴⁵⁴ tʃʰ i n ⁴⁴³	
Xiamen		the front (front side)	2194	2194	tʰau²⁴₃₃tsiŋ²⁴	922	tʰ a u ²⁴ ts i ŋ ²⁴	
Chaozhou		the front (front side)	2194	2194	tʰau⁵⁵₂₁₃tsõĩ⁵⁵	922	tʰ a u ⁵⁵ ts õ ĩ ∼ ⁵⁵	
Fuzhou		the front (front side)	2194	2194	seiŋ⁵²₃₁nau³¹	918	s e i ŋ ⁵² n a u ³¹	
Chengdu		the frost	2034	2034	suaŋ⁴⁴	615	s u a ŋ ⁴⁴	
Beijing		the frost	2034	2034	ʂuaŋ⁵⁵	615	ʂ u a ŋ ⁵⁵	
Jinan		the frost	2034	2034	ʂuaŋ²¹³	615	ʂ u a ŋ ²¹³	
Shenyang		the frost	2034	2034	ʂuaŋ³³	615	ʂ u a ŋ ³³	
Xian		the frost	2034	2034	fɑŋ²¹	615	f ɑ ŋ ²¹	
Kunming		the frost	2034	2034	ʂuã⁴⁴	615	ʂ u ã ∼ ⁴⁴	
Hefei		the frost	2034	2034	ʂuɑ̃²¹²	615	ʂ u ɑ̃ ∼ ²¹²	
Yangzhou		the frost	2034	2034	suɑŋ³¹	615	s u ɑ ŋ ³¹	
Suzhou		the frost	2034	2034	sɒŋ⁴⁴	615	s ɒ ŋ ⁴⁴	
Wenzhou		the frost	2034	2034	ɕyɔ⁴⁴	615	ɕ y ɔ ⁴⁴	
Changsha		the frost	2034	2034	ɕyan³³	615	ɕ y a n ³³	
Nanchang		the frost	2034	2034	sɔŋ⁴²	615	s ɔ ŋ ⁴²	
Meixian		the frost	2034	2034	sɔŋ⁴⁴	615	s ɔ ŋ ⁴⁴	
Guangzhou		the frost	2034	2034	ʃœŋ⁵³	615	ʃ œ ŋ ⁵³	
Yangjiang		the frost	2034	2034	ʃɔŋ³³	615	ʃ ɔ ŋ ³³	
Xiamen		the frost	2034	2034	sῃ⁵⁵	615	s ŋ̍ ⁵⁵	
Chaozhou		the frost	2034	2034	sɯŋ³³	615	s ɯ ŋ ³³	
Fuzhou		the frost	2034	2034	souŋ⁴⁴	615	s o u ŋ ⁴⁴	
Beijing		the head	1256	1256	nau²¹⁴₂₁tai⁰	640	n a u ²¹⁴ t a i ⁰	
Jinan		the head	1256	1256	tʰou⁴²	643	tʰ o u ⁴²	
Shenyang		the head	1256	1256	nau²¹³₂₁tai⁰	640	n a u ²¹³ t a i ⁰	
Xian		the head	1256	1256	nɑn⁵³kʰu⁰	641	n ɑ n ⁵³ kʰ u ⁰	
Chengdu		the head	1256	1256	nau⁵³kʰo³¹	641	n a u ⁵³ kʰ o ³¹	
Kunming		the head	1256	1256	tʰəu³¹	643	tʰ ə u ³¹	
Kunming		the head	1256	1256	nau⁵³kʰuo³¹	641	n a u ⁵³ kʰ u o ³¹	
Hefei		the head	1256	1256	tʰɯ⁵⁵	643	tʰ ɯ ⁵⁵	
Yangzhou		the head	1256	1256	tʰɤɯ³⁴	643	tʰ ɤ ɯ ³⁴	
Suzhou		the head	1256	1256	dʏ²⁴	643	d ʏ ²⁴	
Wenzhou		the head	1256	1256	diu³¹	643	d i u ³¹	
Changsha		the head	1256	1256	lau⁴¹kʰo²⁴	642	l a u ⁴¹ kʰ o ²⁴	
Nanchang		the head	1256	1256	tʰɛu²⁴	643	tʰ ɛ u ²⁴	
Meixian		the head	1256	1256	tʰɛu¹²na¹²	645	tʰ ɛ u ¹² n a ¹²	
Guangzhou		the head	1256	1256	tʰɐu²¹hɔk³³	644	tʰ ɐ u ²¹ h ɔ k ³³	
Yangjiang		the head	1256	1256	tʰɐu⁴⁴³hɔk²¹	644	tʰ ɐ u ⁴⁴³ h ɔ k ²¹	
Xiamen		the head	1256	1256	tʰau²⁴₃₃kʰak³²	644	tʰ a u ²⁴ kʰ a k ³²	
Chaozhou		the head	1256	1256	tʰau⁵⁵₂₁₃kʰak²¹	644	tʰ a u ⁵⁵ kʰ a k ²¹	
Fuzhou		the head	1256	1256	tʰau⁵²	643	tʰ a u ⁵²	
Beijing		the house	1252	1252	faŋ³⁵tsɿ⁰	484	f a ŋ ³⁵ ts ɿ ⁰	
Jinan		the house	1252	1252	faŋ⁴²tsɿ⁰	484	f a ŋ ⁴² ts ɿ ⁰	
Shenyang		the house	1252	1252	faŋ³⁵tsɿ⁰	484	f a ŋ ³⁵ ts ɿ ⁰	
Xian		the house	1252	1252	fɑŋ²⁴tsɿ⁰	484	f ɑ ŋ ²⁴ ts ɿ ⁰	
Chengdu		the house	1252	1252	faŋ³¹tsɿ⁵³	484	f a ŋ ³¹ ts ɿ ⁵³	
Kunming		the house	1252	1252	fã³¹tsɿ⁵³	484	f ã ∼ ³¹ ts ɿ ⁵³	
Hefei		the house	1252	1252	fɑ̃⁵⁵tsə⁰	484	f ɑ̃ ∼ ⁵⁵ ts ə ⁰	
Yangzhou		the house	1252	1252	fɑŋ³⁴tsɛ⁰	484	f ɑ ŋ ³⁴ ts ɛ ⁰	
Suzhou		the house	1252	1252	vɒŋ²⁴₂₂tsɿ⁴¹₄₄	484	v ɒ ŋ ²⁴ ts ɿ ⁴¹	
Suzhou		the house	1252	1252	uɤʔ⁴	485	u ɤ ʔ ⁴	
Wenzhou		the house	1252	1252	u²³duɔ²⁴	486	u ²³ d u ɔ ²⁴	
Changsha		the house	1252	1252	fan¹³tsɿ⁰	484	f a n ¹³ ts ɿ ⁰	
Nanchang		the house	1252	1252	fɔŋ⁵⁵tsɿ⁰	484	f ɔ ŋ ⁵⁵ ts ɿ ⁰	
Meixian		the house	1252	1252	vuk²¹	485	v u k ²¹	
Guangzhou		the house	1252	1252	ʊk⁵	485	ʊ k ⁵	
Yangjiang		the house	1252	1252	ʊk²⁴	485	ʊ k ²⁴	
Xiamen		the house	1252	1252	tsʰu¹¹	487	tsʰ u ¹¹	
Chaozhou		the house	1252	1252	tsʰu²¹³	487	tsʰ u ²¹³	
Fuzhou		the house	1252	1252	tsʰuɔ²¹³	487	tsʰ u ɔ ²¹³	
Beijing		the last year	514	514	tɕʰy⁵¹nian⁰	489	tɕʰ y ⁵¹ n i a n ⁰	
Beijing		the last year	514	514	tʰou³⁵nian⁰	492	tʰ o u ³⁵ n i a n ⁰	
Jinan		the last year	514	514	tɕʰy²¹ȵiæ̃⁰	489	tɕʰ y ²¹ nʲ i æ̃ ∼ ⁰	
Jinan		the last year	514	514	ȵiæ̃⁴²ʂʅ⁰	491	nʲ i æ̃ ∼ ⁴² ʂ ʅ ⁰	
Shenyang		the last year	514	514	tɕʰy⁴¹ȵian⁰	489	tɕʰ y ⁴¹ nʲ i a n ⁰	
Shenyang		the last year	514	514	tʰou³⁵ȵian⁰	492	tʰ o u ³⁵ nʲ i a n ⁰	
Xian		the last year	514	514	tɕʰy⁴⁵ȵiæ̃⁰	489	tɕʰ y ⁴⁵ nʲ i æ̃ ∼ ⁰	
Chengdu		the last year	514	514	tɕʰy¹³ȵian³¹	489	tɕʰ y ¹³ nʲ i a n ³¹	
Kunming		the last year	514	514	tɕʰi¹³niɛ³¹₄₄	489	tɕʰ i ¹³ n i ɛ ³¹	
Hefei		the last year	514	514	tɕʰy⁵³niĩ⁵⁵	489	tɕʰ y ⁵³ n i ĩ ∼ ⁵⁵	
Yangzhou		the last year	514	514	tɕʰy⁵⁵liĩ⁰³⁴	489	tɕʰ y ⁵⁵ l i ĩ ∼ ³⁴	
Yangzhou		the last year	514	514	tsʰəŋ³⁴liĩ⁰	493	tsʰ ə ŋ ³⁴ l i ĩ ∼ ⁰	
Suzhou		the last year	514	514	dʑiʏ³¹₂₂ȵiɪ²⁴₃₃	508	dʑ i ʏ ³¹ nʲ i ɪ ²⁴	
Wenzhou		the last year	514	514	dʑiau¹¹ȵi³¹	508	dʑ i a u ¹¹ nʲ i ³¹	
Changsha		the last year	514	514	kʰə⁵⁵ȵiẽ¹³	489	kʰ ə ⁵⁵ nʲ i ẽ ∼ ¹³	
Nanchang		the last year	514	514	tɕʰiu³¹ȵiɛu⁵⁵	508	tɕʰ i u ³¹ nʲ i ɛ u ⁵⁵	
Meixian		the last year	514	514	kʰiu⁴²ȵiɛn¹²	508	kʰ i u ⁴² nʲ i ɛ n ¹²	
Guangzhou		the last year	514	514	kɐu²²nin²¹₃₅	508	k ɐ u ²² n i n ²¹	
Yangjiang		the last year	514	514	kiɛu⁴⁵⁴nin⁴⁴³	508	k i ɛ u ⁴⁵⁴ n i n ⁴⁴³	
Xiamen		the last year	514	514	ku³³₁₁nĩ²⁴	508	k u ³³ n ĩ ∼ ²⁴	
Chaozhou		the last year	514	514	ku¹¹₁₂ni⁵⁵	508	k u ¹¹ n i ⁵⁵	
Fuzhou		the last year	514	514	kʰɔ²¹³₄₄nieŋ⁵²₄₄maŋ⁵²	490	kʰ ɔ ²¹³ n i e ŋ ⁵² m a ŋ ⁵²	
Beijing		the neck	1333	1333	po³⁵tsɿ⁰	688	p o ³⁵ ts ɿ ⁰	
Jinan		the neck	1333	1333	pə⁴²tsɿ⁰	688	p ə ⁴² ts ɿ ⁰	
Jinan		the neck	1333	1333	pər⁴²kəŋ⁵⁵	689	p ə r ⁴² k ə ŋ ⁵⁵	
Shenyang		the neck	1333	1333	pə³⁵tsɿ⁰	690	p ə ³⁵ ts ɿ ⁰	
Xian		the neck	1333	1333	pʰo²⁴	687	pʰ o ²⁴	
Chengdu		the neck	1333	1333	tɕin⁵³xaŋ¹³	692	tɕ i n ⁵³ x a ŋ ¹³	
Kunming		the neck	1333	1333	po³¹tsɿ⁵³	688	p o ³¹ ts ɿ ⁵³	
Hefei		the neck	1333	1333	nɔ²⁴tɕin²⁴pa⁵³tsə⁰	695	n ɔ ²⁴ tɕ i n ²⁴ p a ⁵³ ts ə ⁰	
Yangzhou		the neck	1333	1333	tɕiŋ⁴²xɑŋ⁵⁵	692	tɕ i ŋ ⁴² x ɑ ŋ ⁵⁵	
Suzhou		the neck	1333	1333	dʏ²⁴₂₂tɕin⁴¹₄₄	696	d ʏ ²⁴ tɕ i n ⁴¹	
Suzhou		the neck	1333	1333	tɕin⁴¹kən⁴⁴₃₅	693	tɕ i n ⁴¹ k ə n ⁴⁴	
Wenzhou		the neck	1333	1333	diu³¹tɕiaŋ⁴⁵	696	d i u ³¹ tɕ i a ŋ ⁴⁵	
Changsha		the neck	1333	1333	tɕin⁴¹kən³³	693	tɕ i n ⁴¹ k ə n ³³	
Nanchang		the neck	1333	1333	tɕiaŋ²¹¹³	691	tɕ i a ŋ ²¹³	
Meixian		the neck	1333	1333	kiaŋ³¹kiun⁴⁴	694	k i a ŋ ³¹ k i u n ⁴⁴	
Guangzhou		the neck	1333	1333	kɛŋ³⁵	691	k ɛ ŋ ³⁵	
Yangjiang		the neck	1333	1333	kɪɕ²¹	691	k ɪ ɕ ²¹	
Xiamen		the neck	1333	1333	am³³₁₁kun⁵¹	698	a m ³³ k u n ⁵¹	
Chaozhou		the neck	1333	1333	am³⁵	697	a m ³⁵	
Fuzhou		the neck	1333	1333	ta⁵²auʔ²³	699	t a ⁵² a u ʔ ²³	
Beijing		the saliva	1503	1503	xa⁵⁵la⁵⁵tsๅ⁰	988	x a ⁵⁵ l a ⁵⁵ ts ɿ ⁰	
Jinan		the saliva	1503	1503	tʂʰʅ²¹³la⁰la⁰	989	ʈʂʰ ʅ ²¹³ l a ⁰ l a ⁰	
Shenyang		the saliva	1503	1503	tsʰๅ³³suei²¹³	990	tsʰ ɿ ³³ s u e i ²¹³	
Shenyang		the saliva	1503	1503	xa³³la³³tsๅ⁰	988	x a ³³ l a ³³ ts ɿ ⁰	
Xian		the saliva	1503	1503	xæ̃²¹fei⁰	991	x æ̃ ∼ ²¹ f e i ⁰	
Chengdu		the saliva	1503	1503	kʰəu⁵³suei⁵³	993	kʰ ə u ⁵³ s u e i ⁵³	
Kunming		the saliva	1503	1503	kʰəu⁵³ʂue⁵³	993	kʰ ə u ⁵³ ʂ u e ⁵³	
Hefei		the saliva	1503	1503	kʰɯ²⁴ʂui²⁴	993	kʰ ɯ ²⁴ ʂ u i ²⁴	
Yangzhou		the saliva	1503	1503	kʰɤɯ⁴²suəi⁴²	993	kʰ ɤ ɯ ⁴² s u ə i ⁴²	
Suzhou		the saliva	1503	1503	zɛ²⁴₂₂tʰəu⁵¹³₄₄	996	z ɛ ²⁴ tʰ ə u ⁵¹³	
Wenzhou		the saliva	1503	1503	kʰau⁴⁵la²⁴sๅ⁴⁵	992	kʰ a u ⁴⁵ l a ²⁴ s ɿ ⁴⁵	
Changsha		the saliva	1503	1503	tsan¹³	995	ts a n ¹³	
Nanchang		the saliva	1503	1503	ɕiɛn⁵⁵	999	ɕ i ɛ n ⁵⁵	
Meixian		the saliva	1503	1503	kʰɛu³¹lan⁴⁴	994	kʰ ɛ u ³¹ l a n ⁴⁴	
Guangzhou		the saliva	1503	1503	hɐu³⁵ʃøy³⁵	993	h ɐ u ³⁵ ʃ ø y ³⁵	
Yangjiang		the saliva	1503	1503	hɐu²¹ʃui²¹	993	h ɐ u ²¹ ʃ u i ²¹	
Xiamen		the saliva	1503	1503	nũã³³	1000	n ũ ã ∼ ³³	
Chaozhou		the saliva	1503	1503	nua³⁵	1000	n u a ³⁵	
Fuzhou		the saliva	1503	1503	laŋ³¹	1000	l a ŋ ³¹	
Beijing		the sheep	1331	1331	iaŋ³⁵	449	i a ŋ ³⁵	
Jinan		the sheep	1331	1331	iaŋ⁴²	449	i a ŋ ⁴²	
Shenyang		the sheep	1331	1331	iaŋ³⁵	449	i a ŋ ³⁵	
Xian		the sheep	1331	1331	iɑŋ²⁴	449	i ɑ ŋ ²⁴	
Chengdu		the sheep	1331	1331	iaŋ³¹tsɿ⁵³	451	i a ŋ ³¹ ts ɿ ⁵³	
Kunming		the sheep	1331	1331	iã³¹	449	i ã ∼ ³¹	
Yangzhou		the sheep	1331	1331	iɑŋ³⁴.	449	i ɑ ŋ ³⁴	
Suzhou		the sheep	1331	1331	iaŋ²⁴	449	i a ŋ ²⁴	
Suzhou		the sheep	1331	1331	iaŋ²⁴₂₂mɒ⁴⁴mɒ⁴⁴₂₁	452	i a ŋ ²⁴ m ɒ ⁴⁴ m ɒ ⁴⁴	
Changsha		the sheep	1331	1331	ian¹³	449	i a n ¹³	
Nanchang		the sheep	1331	1331	iɔŋ⁵⁵	449	i ɔ ŋ ⁵⁵	
Guangzhou		the sheep	1331	1331	jœŋ²¹	449	j œ ŋ ²¹	
Xiamen		the sheep	1331	1331	ĩũ²⁴	449	ĩ ũ ∼ ²⁴	
Chaozhou		the sheep	1331	1331	iẽ⁵⁵	449	i ẽ ∼ ⁵⁵	
Fuzhou		the sheep	1331	1331	yɔŋ⁵²	449	y ɔ ŋ ⁵²	
Hefei		the sheep	1331	1331	iɑ̃⁵⁵	449	i ɑ̃ ∼ ⁵⁵	
Meixian		the sheep	1331	1331	jɔŋ¹²	449	j ɔ ŋ ¹²	
Yangjiang		the sheep	1331	1331	iiɛŋ⁴⁴³	449	i ɛ ŋ ⁴⁴³	
Wenzhou		the sheep	1331	1331	ɦi³¹ῃ⁰	450	ɦ i ³¹ ŋ̍ ⁰	
Beijing		the small knife	1352	1352	ɕiau²¹⁴₂₁taur⁵⁵	577	ɕ i a u ²¹⁴ t a u r ⁵⁵	
Jinan		the small knife	1352	1352	ɕio⁵⁵tɔr²¹³	577	ɕ i o ⁵⁵ t ɔ r ²¹³	
Xian		the small knife	1352	1352	ɕiɑu⁴⁵tɑur²¹	577	ɕ i ɑ u ⁴⁵ t ɑ u r ²¹	
Chengdu		the small knife	1352	1352	tau⁴⁴tər⁴⁴	579	t a u ⁴⁴ t ə r ⁴⁴	
Chengdu		the small knife	1352	1352	tau⁴⁴ɚ³¹	580	t a u ⁴⁴ ə˞ ³¹	
Kunming		the small knife	1352	1352	ɕiau⁵³tau⁴⁴	577	ɕ i a u ⁵³ t a u ⁴⁴	
Kunming		the small knife	1352	1352	tau⁴⁴tsɿ⁵³	581	t a u ⁴⁴ ts ɿ ⁵³	
Yangzhou		the small knife	1352	1352	ɕiɔ⁴²tɔ³¹	577	ɕ i ɔ ⁴² t ɔ ³¹	
Suzhou		the small knife	1352	1352	siæ⁴¹tæ⁴⁴₃₅	577	s i æ ⁴¹ t æ ⁴⁴	
Wenzhou		the small knife	1352	1352	tɜ⁴⁴ῃ⁰	580	t ɜ ⁴⁴ ŋ̍ ⁰	
Changsha		the small knife	1352	1352	ɕiau⁴¹tau³³tsɿ⁰	578	ɕ i a u ⁴¹ t a u ³³ ts ɿ ⁰	
Nanchang		the small knife	1352	1352	ɕiɛu²¹³tau⁴²	577	ɕ i ɛ u ²¹³ t a u ⁴²	
Meixian		the small knife	1352	1352	sɛ⁴²tau⁴⁴ɛ⁰	584	s ɛ ⁴² t a u ⁴⁴ ɛ ⁰	
Guangzhou		the small knife	1352	1352	ʃɐi³³tou⁵³	583	ʃ ɐ i ³³ t o u ⁵³	
Guangzhou		the small knife	1352	1352	tou⁵³tʃɐi³⁵	582	t o u ⁵³ tʃ ɐ i ³⁵	
Yangjiang		the small knife	1352	1352	tou³³tʃɐi²¹	582	t o u ³³ tʃ ɐ i ²¹	
Xiamen		the small knife	1352	1352	to⁵⁵₃₃a⁵¹	582	t o ⁵⁵ a ⁵¹	
Chaozhou		the small knife	1352	1352	to³³₂₃kĩã⁵³	582	t o ³³ k ĩ ã ∼ ⁵³	
Fuzhou		the small knife	1352	1352	tɔ⁴⁴₅₂iaŋ³¹	582	t ɔ ⁴⁴ i a ŋ ³¹	
Shenyang		the small knife	1352	1352	ɕiau²¹³₂₁taur³³	577	ɕ i a u ²¹³ t a u r ³³	
Hefei		the small knife	1352	1352	ɕiɔ²⁴tɔ²¹²tsə⁰	578	ɕ i ɔ ²⁴ t ɔ ²¹² ts ə ⁰	
Guangzhou		there	1937	1937	kɔ³⁵ʃy³³	987	k ɔ ³⁵ ʃ y ³³	
Suzhou		there	1937	1937	kuɛ⁴⁴taʔ⁴₂₁	167	k u ɛ ⁴⁴ t a ʔ ⁴	
Beijing		there	1937	1937	nar⁵¹	296	n a r ⁵¹	
Jinan		there	1937	1937	na²¹li⁰	297	n a ²¹ l i ⁰	
Shenyang		there	1937	1937	na⁴¹	296	n a ⁴¹	
Xian		there	1937	1937	uo⁵³tɑr⁰	300	u o ⁵³ t ɑ r ⁰	
Chengdu		there	1937	1937	nər⁴⁴	296	n ə r ⁴⁴	
Kunming		there	1937	1937	nə¹³tiɛr⁵³	298	n ə ¹³ t i ɛ r ⁵³	
Hefei		there	1937	1937	na⁵³kɐʔ⁴tsə⁰	299	n a ⁵³ k ɐ ʔ ⁴ ts ə ⁰	
Yangzhou		there	1937	1937	ləʔ⁴kʰuɛ⁰	302	l ə ʔ ⁴ kʰ u ɛ ⁰	
Suzhou		there	1937	1937	uɛ⁴⁴taʔ⁴₂₁	300	u ɛ ⁴⁴ t a ʔ ⁴	
Wenzhou		there	1937	1937	ba¹²ta⁴⁴	303	b a ¹² t a ⁴⁴	
Changsha		there	1937	1937	la⁵⁵li⁰	297	l a ⁵⁵ l i ⁰	
Nanchang		there	1937	1937	hɛ²⁴li⁰	304	h ɛ ²⁴ l i ⁰	
Meixian		there	1937	1937	kɛ⁴²ɛ⁰	305	k ɛ ⁴² ɛ ⁰	
Meixian		there	1937	1937	kɛ⁴²lɛ³¹	306	k ɛ ⁴² l ɛ ³¹	
Guangzhou		there	1937	1937	kɔ³⁵tou²²	986	k ɔ ³⁵ t o u ²²	
Yangjiang		there	1937	1937	nai²¹ʃi²⁴	308	n a i ²¹ ʃ i ²⁴	
Xiamen		there	1937	1937	hia²⁴	309	h i a ²⁴	
Xiamen		there	1937	1937	hit³²₅ui³³	310	h i t ³² u i ³³	
Chaozhou		there	1937	1937	hɯ⁵³₂₄ko²¹³	311	h ɯ ⁵³ k o ²¹³	
Fuzhou		there	1937	1937	xuai⁵²nœ³¹	312	x u a i ⁵² n œ ³¹	
Fuzhou		there	1937	1937	xu⁴⁴uai³¹	313	x u ⁴⁴ u a i ³¹	
Beijing		thick	1244	1244	xou⁵¹	74	x o u ⁵¹	
Jinan		thick	1244	1244	xou²¹	74	x o u ²¹	
Shenyang		thick	1244	1244	xou⁴¹	74	x o u ⁴¹	
Xian		thick	1244	1244	xou⁴⁵	74	x o u ⁴⁵	
Chengdu		thick	1244	1244	xəu¹³	74	x ə u ¹³	
Kunming		thick	1244	1244	xəu¹³	74	x ə u ¹³	
Hefei		thick	1244	1244	xɯ⁵³	74	x ɯ ⁵³	
Yangzhou		thick	1244	1244	xɤɯ⁵⁵	74	x ɤ ɯ ⁵⁵	
Suzhou		thick	1244	1244	ɦʏ³¹	74	ɦ ʏ ³¹	
Wenzhou		thick	1244	1244	gau²⁴	74	g a u ²⁴	
Changsha		thick	1244	1244	xəu²¹	74	x ə u ²¹	
Nanchang		thick	1244	1244	hɛu³¹	74	h ɛ u ³¹	
Meixian		thick	1244	1244	pʰun⁴⁴	75	pʰ u n ⁴⁴	
Guangzhou		thick	1244	1244	hɐu²³	74	h ɐ u ²³	
Yangjiang		thick	1244	1244	hɐu²¹	74	h ɐ u ²¹	
Xiamen		thick	1244	1244	kau³³	74	k a u ³³	
Chaozhou		thick	1244	1244	kau³⁵	74	k a u ³⁵	
Fuzhou		thick	1244	1244	kau²⁴²	74	k a u ²⁴²	
Beijing		to lie down	215	215	tʰaŋ²¹⁴	1125	tʰ a ŋ ²¹⁴	
Jinan		to lie down	215	215	tʰaŋ⁵⁵	1125	tʰ a ŋ ⁵⁵	
Shenyang		to lie down	215	215	tʰaŋ²¹³	1125	tʰ a ŋ ²¹³	
Xian		to lie down	215	215	tʰɑŋ⁵³	1125	tʰ ɑ ŋ ⁵³	
Chengdu		to lie down	215	215	tʰaŋ⁵³	1125	tʰ a ŋ ⁵³	
Kunming		to lie down	215	215	tʰã⁵³	1125	tʰ ã ∼ ⁵³	
Hefei		to lie down	215	215	tʰɑ̃²⁴	1125	tʰ ɑ̃ ∼ ²⁴	
Yangzhou		to lie down	215	215	tʰɑŋ⁴²	1125	tʰ ɑ ŋ ⁴²	
Suzhou		to lie down	215	215	kʰuən⁵¹³	1126	kʰ u ə n ⁵¹³	
Suzhou		to lie down	215	215	gɛ³¹	1127	g ɛ ³¹	
Wenzhou		to lie down	215	215	fa⁴⁴	1128	f a ⁴⁴	
Changsha		to lie down	215	215	tʰan⁴¹	1125	tʰ a n ⁴¹	
Nanchang		to lie down	215	215	tʰɔŋ²¹³	1125	tʰ ɔ ŋ ²¹³	
Meixian		to lie down	215	215	min¹²	1129	m i n ¹²	
Guangzhou		to lie down	215	215	fɐn³³	1130	f ɐ n ³³	
Yangjiang		to lie down	215	215	ʃui⁴⁵⁴	1131	ʃ u i ⁴⁵⁴	
Xiamen		to lie down	215	215	to⁵¹	1132	t o ⁵¹	
Chaozhou		to lie down	215	215	to⁵³	1132	t o ⁵³	
Chaozhou		to lie down	215	215	kũã²¹³	1133	k ũ ã ∼ ²¹³	
Fuzhou		to lie down	215	215	tɔ³¹	1132	t ɔ ³¹	
Beijing		to play	1413	1413	uanr³⁵	1229	u a n r ³⁵	
Jinan		to play	1413	1413	uæ̃r⁴²	1229	u æ̃ ∼ r ⁴²	
Xian		to play	1413	1413	fɑ⁵³	1230	f ɑ ⁵³	
Chengdu		to play	1413	1413	sua⁵³	1230	s u a ⁵³	
Kunming		to play	1413	1413	ʂua⁵³	1230	ʂ u a ⁵³	
Hefei		to play	1413	1413	uæ̃⁵⁵	1229	u æ̃ ∼ ⁵⁵	
Yangzhou		to play	1413	1413	uɛ̃³⁴	1229	u ɛ̃ ∼ ³⁴	
Suzhou		to play	1413	1413	bɤʔ²³siaŋ⁴⁴₂₁	1231	b ɤ ʔ ²³ s i a ŋ ⁴⁴	
Wenzhou		to play	1413	1413	sๅ⁴⁴	1232	s ɿ ⁴⁴	
Nanchang		to play	1413	1413	uan⁵⁵	1229	u a n ⁵⁵	
Nanchang		to play	1413	1413	ȵiɛt⁵	1233	nʲ i ɛ t ⁵	
Meixian		to play	1413	1413	kau³¹	1234	k a u ³¹	
Meixian		to play	1413	1413	liau³¹	1235	l i a u ³¹	
Guangzhou		to play	1413	1413	wan²³	1229	w a n ²³	
Guangzhou		to play	1413	1413	fan³⁵	4	f a n ³⁵	
Yangjiang		to play	1413	1413	nɪk²⁴	5	n ɪ k ²⁴	
Xiamen		to play	1413	1413	tsʰit³²₅tʰo²⁴	6	tsʰ i t ³² tʰ o ²⁴	
Chaozhou		to play	1413	1413	tʰik²¹₄tʰo⁵⁵	7	tʰ i k ²¹ tʰ o ⁵⁵	
Fuzhou		to play	1413	1413	kʰa⁴⁴liu⁵²	8	kʰ a ⁴⁴ l i u ⁵²	
